A1: size | B1: start | C1: end | D1: Superblock
A3: 4 | B3: =C2+1 -> 1 | C3: =C2+A3 -> 4 | D3: Total number of inodes
A4: 4 | B4: =C3+1 -> 5 | C4: =C3+A4 -> 8 | D4: Filesystem size in blocks
A5: 4 | B5: =C4+1 -> 9 | C5: =C4+A5 -> 12 | D5: Number of reserved blocks
A6: 4 | B6: =C5+1 -> 13 | C6: =C5+A6 -> 16 | D6: Free blocks counter
A7: 4 | B7: =C6+1 -> 17 | C7: =C6+A7 -> 20 | D7: Free inodes counter
A8: 4 | B8: =C7+1 -> 21 | C8: =C7+A8 -> 24 | D8: Number of first useful block (always 1)
A9: 4 | B9: =C8+1 -> 25 | C9: =C8+A9 -> 28 | D9: Block size
A10: 4 | B10: =C9+1 -> 29 | C10: =C9+A10 -> 32 | D10: Fragment size
A11: 4 | B11: =C10+1 -> 33 | C11: =C10+A11 -> 36 | D11: Number of blocks per group
A12: 4 | B12: =C11+1 -> 37 | C12: =C11+A12 -> 40 | D12: Number of fragments per group
A13: 4 | B13: =C12+1 -> 41 | C13: =C12+A13 -> 44 | D13: Number of inodes per group
A14: 4 | B14: =C13+1 -> 45 | C14: =C13+A14 -> 48 | D14: Time of last mount operation
A15: 4 | B15: =C14+1 -> 49 | C15: =C14+A15 -> 52 | D15: Time of last write operation
A16: 2 | B16: =C15+1 -> 53 | C16: =C15+A16 -> 54 | D16: Mount operations counter
A17: 2 | B17: =C16+1 -> 55 | C17: =C16+A17 -> 56 | D17: Number of mount operations before check
A18: 2 | B18: =C17+1 -> 57 | C18: =C17+A18 -> 58 | D18: Magic signature
A19: 2 | B19: =C18+1 -> 59 | C19: =C18+A19 -> 60 | D19: Status flag
A20: 2 | B20: =C19+1 -> 61 | C20: =C19+A20 -> 62 | D20: Behavior when detecting errors
A21: 2 | B21: =C20+1 -> 63 | C21: =C20+A21 -> 64 | D21: Minor revision level
A22: 4 | B22: =C21+1 -> 65 | C22: =C21+A22 -> 68 | D22: Time of last check
A23: 4 | B23: =C22+1 -> 69 | C23: =C22+A23 -> 72 | D23: Time between checks
A24: 4 | B24: =C23+1 -> 73 | C24: =C23+A24 -> 76 | D24: OS where filesystem was created
A25: 4 | B25: =C24+1 -> 77 | C25: =C24+A25 -> 80 | D25: Revision level
A26: 2 | B26: =C25+1 -> 81 | C26: =C25+A26 -> 82 | D26: Default user ID for reserved blocks
A27: 2 | B27: =C26+1 -> 83 | C27: =C26+A27 -> 84 | D27: Default group ID for reserved blocks
A28: 4 | B28: =C27+1 -> 85 | C28: =C27+A28 -> 88 | D28: Number of first nonreserved inode
A29: 2 | B29: =C28+1 -> 89 | C29: =C28+A29 -> 90 | D29: Size of on-disk inode structure
A30: 2 | B30: =C29+1 -> 91 | C30: =C29+A30 -> 92 | D30: Block group number of this superblock
A31: 4 | B31: =C30+1 -> 93 | C31: =C30+A31 -> 96 | D31: Compatible features bitmap
A32: 4 | B32: =C31+1 -> 97 | C32: =C31+A32 -> 100 | D32: Incompatible features bitmap
A33: 4 | B33: =C32+1 -> 101 | C33: =C32+A33 -> 104 | D33: Read-only-compatible features bitmap
A34: 16 | B34: =C33+1 -> 105 | C34: =C33+A34 -> 120 | D34: 128-bit filesystem identifier
A35: 16 | B35: =C34+1 -> 121 | C35: =C34+A35 -> 136 | D35: Volume name
A36: 64 | B36: =C35+1 -> 137 | C36: =C35+A36 -> 200 | D36: Path of last mount point
A37: 4 | B37: =C36+1 -> 201 | C37: =C36+A37 -> 204 | D37: Used for compression
A38: 1 | B38: =C37+1 -> 205 | C38: =C37+A38 -> 205 | D38: Number of blocks to preallocate
A39: 1 | B39: =C38+1 -> 206 | C39: =C38+A39 -> 206 | D39: Number of blocks to preallocate for directories
A40: 818 | B40: =C39+1 -> 207 | C40: =C39+A40 -> 1024 | D40: Nulls to pad out 1024 bytes

A1: Total number of inodes | B1: b8 00 00 00 = 000000b8 = 184 decimal
A2: Filesystem size in blocks | B2: a0 05 00 00 = 000005a0 = 1440
A3: Number of reserved blocks | B3: 48 00 00 00 = 00000048 = 72
A4: Free blocks counter | B4: 74 05 00 00 = 00000574 = 1396
A5: Free inodes counter | B5: aa 00 00 00 = 000000aa = 170

D1: Group Descriptor
A3: 4 | B3: =C2+1 -> 1 | C3: =C2+A3 -> 4 | D3: Block number of block bitmap
A4: 4 | B4: =C3+1 -> 5 | C4: =C3+A4 -> 8 | D4: Block number of inode bitmap
A5: 4 | B5: =C4+1 -> 9 | C5: =C4+A5 -> 12 | D5: Block number of first inode table block
A6: 2 | B6: =C5+1 -> 13 | C6: =C5+A6 -> 14 | D6: Number of free blocks in the group
A7: 2 | B7: =C6+1 -> 15 | C7: =C6+A7 -> 16 | D7: Number of free inodes in the group
A8: 2 | B8: =C7+1 -> 17 | C8: =C7+A8 -> 18 | D8: Number of directories in the group
A9: 2 | B9: =C8+1 -> 19 | C9: =C8+A9 -> 20 | D9: Alignment to word
A10: 4 | B10: =C9+1 -> 21 | C10: =C9+A10 -> 24 | D10: Nulls to pad out 24 bytes

E1: Inode
A3: 2 | B3: =C2+1 -> 1 | C3: =C2+A3 -> 2 | E3: File type and access rights
A4: 2 | B4: =C3+1 -> 3 | C4: =C3+A4 -> 4 | E4: Owner identification
A5: 4 | B5: =C4+1 -> 5 | C5: =C4+A5 -> 8 | E5: File length in bytes
A6: 4 | B6: =C5+1 -> 9 | C6: =C5+A6 -> 12 | E6: Time of last file access
A7: 4 | B7: =C6+1 -> 13 | C7: =C6+A7 -> 16 | E7: Time that inode last changed
A8: 4 | B8: =C7+1 -> 17 | C8: =C7+A8 -> 20 | E8: Time that file contents last changed
A9: 4 | B9: =C8+1 -> 21 | C9: =C8+A9 -> 24 | E9: Time of file deletion
A10: 2 | B10: =C9+1 -> 25 | C10: =C9+A10 -> 26 | E10: Group identifier
A11: 2 | B11: =C10+1 -> 27 | C11: =C10+A11 -> 28 | E11: Hard links counter
A12: 4 | B12: =C11+1 -> 29 | C12: =C11+A12 -> 32 | E12: Number of data blocks of the file
A13: 4 | B13: =C12+1 -> 33 | C13: =C12+A13 -> 36 | E13: File flags
A14: 4 | B14: =C13+1 -> 37 | C14: =C13+A14 -> 40 | E14: Specific operating system information
A15: 4 | B15: =C14+1 -> 41 | C15: =C14+A15 -> 44 | E15: Pointer to first data block
A16: 56 | B16: =C15+1 -> 45 | C16: =C15+A16 -> 100 | E16: 14 more pointers to data blocks
A17: 4 | B17: =C16+1 -> 101 | C17: =C16+A17 -> 104 | E17: File version (for NFS)
A18: 4 | B18: =C17+1 -> 105 | C18: =C17+A18 -> 108 | E18: File access control list
A19: 4 | B19: =C18+1 -> 109 | C19: =C18+A19 -> 112 | E19: Directory access control list
A20: 4 | B20: =C19+1 -> 113 | C20: =C19+A20 -> 116 | E20: Fragment address
A21: 8 | B21: =C20+1 -> 117 | C21: =C20+A21 -> 124 | E21: Specific operating system information

A1: size | B1: start | C1: end | E1: Directory Entry
A3: 4 | B3: =C2+1 -> 1 | C3: =C2+A3 -> 4 | E3: Inode number
A4: 2 | B4: =C3+1 -> 5 | C4: =C3+A4 -> 6 | E4: This directory entry's length
A5: 1 | B5: =C4+1 -> 7 | C5: =C4+A5 -> 7 | E5: File name length
A6: 1 | B6: =C5+1 -> 8 | C6: =C5+A6 -> 8 | E6: File type (1=regular file 2=directory)
B7: =C6+1 -> 9 | C7: ? | E7: File name